statement,timestamp,link
Apartment REITs: Tale Of Two Americas,Feb-24,https://seekingalpha.com/article/4408576-apartment-reits-tale-of-two-americas?source=feed_tag_editors_picks
Transocean - Strong Cash Flow^ Constructive Conference Call^ Decent Medium-Term Outlook,Feb-24,https://seekingalpha.com/article/4408526-transocean-strong-cash-flow-constructive-conference-call-decent-medium-term-outlook?source=feed_tag_editors_picks
Covid-19 Pressures Rival Vaccine Producers to Being Friendly Enemies,Feb-24,https://www.thestreet.com/mishtalk/economics/covid-19-pressures-rival-vaccine-producers-to-being-friendly-enemies
Non Fungible Tokens (NFT’s)  – Tell Me More Howie,Feb-24,https://howardlindzon.com/non-fungible-tokens-nfts-tell-me-more-howie/
Workhorse: Share Price Cut In Half After Rival Oshkosh Awarded Key USPS Contract - A Short Position Could Still Yield Decent Returns,Feb-24,https://seekingalpha.com/article/4408510-workhorse-share-price-cut-in-half-after-rival-oshkosh-awarded-key-usps-contract?source=feed_tag_editors_picks
Aviva Share Price: Q4 Earnings Due – What to Expect?,Feb-24,https://vantagepointtrading.com/news/aviva-share-price-q4-earnings-due-what-to-expect/
Daily Market Recap for 24/02/2021: GBP’s Rally Continues^ While Gold Price Action Lags,Feb-24,https://vantagepointtrading.com/news/daily-market-recap-for-24-02-2021-gbps-rally-continues-while-gold-price-action-lags/
McDonald’s Continues to Weather the COVID-19 Pandemic,Feb-24,https://vantagepointtrading.com/news/mcdonalds-continues-to-weather-the-covid-19-pandemic/
Sellers hit Nasdaq and S&P 50-day MAs,Feb-23,http://feedproxy.google.com/~r/FallondStockPicks/~3/kwV6gI_Kwdk/sellers-hit-nasdaq-and-s-50-day-mas.html
The Fed Soothes the Market Today With More Easy Money Talk,Feb-23,https://www.thestreet.com/mishtalk/economics/the-fed-soothes-the-market-today-with-more-easy-money-talk
Tuesday links: blowing stuff up,Feb-23,http://feedproxy.google.com/~r/abnormalreturns/~3/voiRxATW_zQ/
Research links: random retail flow,Feb-23,http://feedproxy.google.com/~r/abnormalreturns/~3/70Uiq-7rzaM/
Non Fungible Tokens (NFT’s) …I Can’t Believe I Have To Learn This,Feb-23,https://howardlindzon.com/non-fungible-tokens-nfts-i-cant-believe-i-have-to-learn-this/
Capita Share Price: Q4 2020 Earnings Due Next Week – What to Expect?,Feb-23,https://vantagepointtrading.com/news/capita-share-price-q4-2020-earnings-due-next-week-what-to-expect/
Daily Market Recap for 23/02/2021: FTSE 100 in a Tight Range^ EURGBP Remains Weaks,Feb-23,https://vantagepointtrading.com/news/daily-market-recap-for-23-02-2021-ftse-100-in-a-tight-range-eurgbp-remains-weaks/
The Great Reset Is Here,Feb-22,http://feedproxy.google.com/~r/dailyreckoning/~3/NjFfJua8FxM/
Aston Martin Share Price: Q4 202 Earnings Due This Week,Feb-22,https://vantagepointtrading.com/news/aston-martin-share-price-q4-202-earnings-due-this-week/
Momentum Monday….Inflation Baby!!,Feb-22,https://howardlindzon.com/momentum-monday-inflation-baby/
Russell 2000 ends the week on a high,Feb-21,http://feedproxy.google.com/~r/FallondStockPicks/~3/_Tj3ljqGt2U/russell-2000-ends-week-on-high.html
How We Tranceform The Mindscape,Feb-21,http://traderfeed.blogspot.com/2021/02/how-we-tranceform-mindscape.html
COVID Will Fade^ BUT…,Feb-20,http://feedproxy.google.com/~r/dailyreckoning/~3/RnU8ahIs1rQ/
The Blockchain….What Is On The Other Side?,Feb-20,https://howardlindzon.com/the-blockchain-what-is-on-the-other-side/
Platforms and Twitter And Of Course Stocktwits…,Feb-19,https://howardlindzon.com/platforms-and-twitter-and-of-course-stocktwits/
Low volume selling finds support,Feb-18,http://feedproxy.google.com/~r/FallondStockPicks/~3/pDt_QN0EDms/low-volume-selling-finds-support.html
Will the Truth Really Set You Free?,Feb-18,http://feedproxy.google.com/~r/dailyreckoning/~3/ZxQ06xNylKQ/
Shopify President Harley Finkelstein Joins Me on Panic with Friends to Discuss the Future of E-Commerce and Positioning Shopify as the Go-To Platform for Entrepreneurs,Feb-18,https://howardlindzon.com/shopify-president-harley-finkelstein-joins-me-on-panic-with-friends-to-discuss-the-future-of-e-commerce-and-positioning-shopify-as-the-go-to-platform-for-entrepreneurs/
How This Boom/Bubble Ends,Feb-17,https://howardlindzon.com/how-this-boom-bubble-ends/
Light Selling,Feb-16,http://feedproxy.google.com/~r/FallondStockPicks/~3/0WpDOzm58NQ/light-selling.html
It’s a Game of Musical Chairs,Feb-16,http://feedproxy.google.com/~r/dailyreckoning/~3/dE5YNNcbtd0/
Buyers consume selling pressure,Feb-14,http://feedproxy.google.com/~r/FallondStockPicks/~3/LTjES1CleoY/buyers-consume-selling-pressure.html
Who Killed the Middle Class?,Feb-13,http://feedproxy.google.com/~r/dailyreckoning/~3/6iKCQsC97rY/
Learning How To Lose,Feb-12,http://traderfeed.blogspot.com/2021/02/learning-how-to-lose.html
Green New Deal Is Underway,Feb-11,http://feedproxy.google.com/~r/dailyreckoning/~3/bvrspsh8iq4/
Sellers Make A Return,Feb-10,http://feedproxy.google.com/~r/FallondStockPicks/~3/vTceH-pL2X0/sellers-make-return.html
The Fed Faces Two Choices,Feb-10,http://feedproxy.google.com/~r/dailyreckoning/~3/x_VC5d7CLPk/
The Only Way Out of the Death Trap,Feb-09,http://feedproxy.google.com/~r/dailyreckoning/~3/p0e34PlURGE/
Indices Repeat Friday's Action - Russell 2000 leads,Feb-08,http://feedproxy.google.com/~r/FallondStockPicks/~3/FOv98f91tKQ/indices-repeat-fridays-action-russell.html
Friday's Market Doji Point To Indecision,Feb-07,http://feedproxy.google.com/~r/FallondStockPicks/~3/WaeNkjnk0Ko/fridays-market-doji-point-to-indecision.html
The Best Way To Develop Trading Expertise,Feb-05,http://traderfeed.blogspot.com/2021/02/the-best-way-to-develop-trading.html
